{
  "$schema": "../schema.json",
  "name": "My Awesome Tool",
  "version": "1.2.3-alpha",
  "description": "An awesome tool built in C",
  "variables": {
    "src": "./src",
    "out": "./out",
    "cc": "clang",
    "ccflags": "-Wall",
    "ldflags": ""
  },
  "targets": {
    "clean": {
      "cmd": "rm -rf ${out}/*"
    },
    "install": {
      "cmd": [
        "cp ${out}/**/*.o /usr/local/lib/",
        "cp ${src}/**/*.h /usr/local/include/",
        "cp ${out}/awesometool /usr/local/bin/"
      ]
    },
    "${out}/*.o": {
      "in": "${src}/*.c",
      "cmd": "${cc} -c ${ccflags} -o ${:target} ${:in}"
    },
    "${out}/awesometool": {
      "default": true,
      "in": ["${out}/*.o"],
      "cmd": "${cc} ${ldflags} -o ${:target} ${:in}"
    }
  }
}
