{
  "$schema": "../schema.json",
  "name": "My Awesome Tool",
  "version": "1.2.3-alpha",
  "description": "An awesome tool with dependencies",
  "variables": {
    "lib": "./lib"
  },
  "projectDependencies": {
    "${lib}/uthash/uthash.h": {
      "source": "https://github.com/troydhanson/uthash/blob/master/src/uthash.h"
    },
    "${lib}/log.c/": {
      "source": "git://https://github.com/rxi/log.c",
      "install": "cp src/* ./ && rm -rf src"
    },
    "${lib}/something/": {
      "source": "../libsomething/"
    }
  },
  "targets": {
    "clean": {
      "cmd": "rm -rf ${lib}/*"
    }
  }
}
